{
  "schema_version": "1.0",
  "graph_id": "payment-prod-20260826",
  "discovered_at": "2026-08-26T13:30:00Z",
  "scope": {
    "environment": "production",
    "account": "example-prod",
    "region": "ap-northeast-2",
    "cluster": "prod-a"
  },
  "resources": [
    {
      "id": "svc:payment-api",
      "kind": "service",
      "provider": "kubernetes",
      "name": "payment-api",
      "service": "payment-api",
      "environment": "production",
      "attributes": {"namespace": "payment", "workload": "deployment/payment-api"},
      "provenance": {
        "adapter": "kubernetes-discovery",
        "reference": "cluster/prod-a/namespace/payment/deployment/payment-api",
        "observed_at": "2026-08-26T13:30:00Z"
      }
    },
    {
      "id": "db:orders",
      "kind": "database",
      "provider": "aws-rds",
      "name": "orders-db",
      "service": "payment-api",
      "environment": "production",
      "attributes": {"engine": "postgresql", "region": "ap-northeast-2"},
      "provenance": {
        "adapter": "aws-discovery",
        "reference": "rds/orders-db",
        "observed_at": "2026-08-26T13:30:00Z"
      }
    },
    {
      "id": "obs:payment",
      "kind": "observability",
      "provider": "datadog",
      "name": "payment-observability",
      "service": "payment-api",
      "environment": "production",
      "attributes": {"signals": ["metrics", "traces", "logs"]},
      "provenance": {
        "adapter": "observability-discovery",
        "reference": "service/payment-api",
        "observed_at": "2026-08-26T13:30:00Z"
      }
    }
  ],
  "edges": [
    {"from": "svc:payment-api", "to": "db:orders", "relationship": "depends_on"},
    {"from": "svc:payment-api", "to": "obs:payment", "relationship": "observed_by"}
  ]
}
